{
  "schema": "sipi.conformance-rule-ledger.v1",
  "scope": {"task": "M1-06", "authority_path": "schemas/authority.v1.yaml"},
  "authority_sha256": "fe5424db48dfa01cb7c2f896143f631b03b00d880d81a3520843cca8b8a07309",
  "rules": [
    {"id":"run-request.producer.schema","schema_id":"sipi.run-request.v1","obligation":"producer","layer":"schema","evidence":{"python":{"state":"covered","implementation_refs":["sipi_contracts.models.parse_run_request"],"case_refs":[{"id":"run-request.strict.good","document":"subject"},{"id":"run-request.auto.good","document":"subject"},{"id":"run-request.compare.good","document":"subject"},{"id":"run-request.strict.auto-field.reject","document":"subject"},{"id":"run-request.auto.strict-field.reject","document":"subject"},{"id":"run-request.compare.auto-field.reject","document":"subject"},{"id":"run-request.unknown.reject","document":"subject"},{"id":"run-request.limit.zero.reject","document":"subject"},{"id":"selection-chain.schema.run-request.reject","document":"run_request"}]},"rust":{"state":"covered","implementation_refs":["rust-consumer.validate"],"case_refs":[{"id":"run-request.strict.good","document":"subject"},{"id":"run-request.auto.good","document":"subject"},{"id":"run-request.compare.good","document":"subject"},{"id":"run-request.strict.auto-field.reject","document":"subject"},{"id":"run-request.auto.strict-field.reject","document":"subject"},{"id":"run-request.compare.auto-field.reject","document":"subject"},{"id":"run-request.unknown.reject","document":"subject"},{"id":"run-request.limit.zero.reject","document":"subject"},{"id":"selection-chain.schema.run-request.reject","document":"run_request"}]}}},
    {"id":"run-request.producer.semantic","schema_id":"sipi.run-request.v1","obligation":"producer","layer":"semantic","evidence":{"python":{"state":"covered","implementation_refs":["sipi_contracts.validation.relations.validate_request"],"case_refs":[{"id":"run-request.strict.internal.reject","document":"subject"},{"id":"run-request.compare.same-instance.reject","document":"subject"}]},"rust":{"state":"covered","implementation_refs":["rust-consumer.semantic_error"],"case_refs":[{"id":"run-request.strict.internal.reject","document":"subject"},{"id":"run-request.compare.same-instance.reject","document":"subject"}]}}},
    {"id":"run-request.producer.resource-relation","schema_id":"sipi.run-request.v1","obligation":"producer","layer":"relation","evidence":{"python":{"state":"covered","implementation_refs":["sipi_contracts.validation.relations.validate_resource_slice"],"case_refs":[{"id":"resource.slice.reject","document":"pair"},{"id":"resource.slice.invent-limit.reject","document":"pair"},{"id":"resource.required.unsupported.reject","document":"pair"}]},"rust":{"state":"covered","implementation_refs":["rust-consumer.resource_slice_valid"],"case_refs":[{"id":"resource.slice.reject","document":"pair"},{"id":"resource.slice.invent-limit.reject","document":"pair"},{"id":"resource.required.unsupported.reject","document":"pair"}]}}},
    {"id":"run-request.producer.inventory-unverified","schema_id":"sipi.run-request.v1","obligation":"producer","layer":"relation","evidence":{"python":{"state":"gap","implementation_refs":["sipi_contracts.validation.relations.validate_request"],"case_refs":[]},"rust":{"state":"gap","implementation_refs":["rust-consumer.validate"],"case_refs":[]}}},
    {"id":"run-request.consumer.strict-schema","schema_id":"sipi.run-request.v1","obligation":"consumer","layer":"schema","evidence":{"python":{"state":"covered","implementation_refs":["sipi_contracts.models.parse_run_request"],"case_refs":[{"id":"run-request.consumer.good","document":"subject"},{"id":"run-request.consumer.unknown.reject","document":"subject"},{"id":"run-request.consumer.version.reject","document":"subject"}]},"rust":{"state":"covered","implementation_refs":["rust-consumer.validate"],"case_refs":[{"id":"run-request.consumer.good","document":"subject"},{"id":"run-request.consumer.unknown.reject","document":"subject"},{"id":"run-request.consumer.version.reject","document":"subject"}]}}},
    {"id":"run-request.consumer.schema-inventory-unverified","schema_id":"sipi.run-request.v1","obligation":"consumer","layer":"schema","evidence":{"python":{"state":"gap","implementation_refs":["sipi_contracts.models.parse_run_request"],"case_refs":[]},"rust":{"state":"gap","implementation_refs":["rust-consumer.validate"],"case_refs":[]}}},
    {"id":"run-request.consumer.semantic-unverified","schema_id":"sipi.run-request.v1","obligation":"consumer","layer":"semantic","evidence":{"python":{"state":"gap","implementation_refs":["sipi_contracts.models.parse_run_request"],"case_refs":[]},"rust":{"state":"gap","implementation_refs":["rust-consumer.validate"],"case_refs":[]}}},

    {"id":"run-result.producer.schema","schema_id":"sipi.run-result.v1","obligation":"producer","layer":"schema","evidence":{"python":{"state":"covered","implementation_refs":["sipi_contracts.models.parse_run_result"],"case_refs":[{"id":"run-result.strict.good","document":"subject"},{"id":"run-result.auto.good","document":"subject"},{"id":"run-result.compare.good","document":"subject"},{"id":"selection-chain.schema.run-result.reject","document":"run_result"}]},"rust":{"state":"covered","implementation_refs":["rust-consumer.validate"],"case_refs":[{"id":"run-result.strict.good","document":"subject"},{"id":"run-result.auto.good","document":"subject"},{"id":"run-result.compare.good","document":"subject"},{"id":"selection-chain.schema.run-result.reject","document":"run_result"}]}}},
    {"id":"run-result.producer.semantic","schema_id":"sipi.run-result.v1","obligation":"producer","layer":"semantic","evidence":{"python":{"state":"covered","implementation_refs":["sipi_contracts.validation.relations.validate_result_intrinsic"],"case_refs":[{"id":"run-result.auto.prefix.reject","document":"subject"},{"id":"run-result.auto.next-candidate.reject","document":"subject"},{"id":"run-result.auto.multiple-execution.reject","document":"subject"},{"id":"run-result.auto.failed.partial-trace.reject","document":"subject"},{"id":"run-result.compare.roles.reject","document":"subject"},{"id":"run-result.compare.instance.reject","document":"subject"},{"id":"run-result.compare.profile.reject","document":"subject"},{"id":"run-result.succeeded.failed-execution.reject","document":"subject"}]},"rust":{"state":"covered","implementation_refs":["rust-consumer.semantic_error"],"case_refs":[{"id":"run-result.auto.prefix.reject","document":"subject"},{"id":"run-result.auto.next-candidate.reject","document":"subject"},{"id":"run-result.auto.multiple-execution.reject","document":"subject"},{"id":"run-result.auto.failed.partial-trace.reject","document":"subject"},{"id":"run-result.compare.roles.reject","document":"subject"},{"id":"run-result.compare.instance.reject","document":"subject"},{"id":"run-result.compare.profile.reject","document":"subject"},{"id":"run-result.succeeded.failed-execution.reject","document":"subject"}]}}},
    {"id":"run-result.producer.relation","schema_id":"sipi.run-result.v1","obligation":"producer","layer":"relation","evidence":{"python":{"state":"covered","implementation_refs":["sipi_contracts.models.validate_run_result"],"case_refs":[{"id":"selection-chain.strict.accept","document":"run_result"},{"id":"selection-chain.identity.run-result.reject","document":"run_result"},{"id":"selection-chain.identity.summary.reject","document":"run_result"}]},"rust":{"state":"covered","implementation_refs":["rust-consumer.validate"],"case_refs":[{"id":"selection-chain.strict.accept","document":"run_result"},{"id":"selection-chain.identity.run-result.reject","document":"run_result"},{"id":"selection-chain.identity.summary.reject","document":"run_result"}]}}},
    {"id":"run-result.producer.inventory-unverified","schema_id":"sipi.run-result.v1","obligation":"producer","layer":"relation","evidence":{"python":{"state":"gap","implementation_refs":["sipi_contracts.validation.relations.validate_result"],"case_refs":[]},"rust":{"state":"gap","implementation_refs":["rust-consumer.validate"],"case_refs":[]}}},
    {"id":"run-result.consumer.preservation","schema_id":"sipi.run-result.v1","obligation":"consumer","layer":"preservation","evidence":{"python":{"state":"covered","implementation_refs":["sipi_contracts.models.parse_run_result"],"case_refs":[{"id":"run-result.consumer.unknown.accept","document":"subject"}]},"rust":{"state":"covered","implementation_refs":["rust-consumer.validate"],"case_refs":[{"id":"run-result.consumer.unknown.accept","document":"subject"}]}}},
    {"id":"run-result.consumer.schema-evolution","schema_id":"sipi.run-result.v1","obligation":"consumer","layer":"schema","evidence":{"python":{"state":"covered","implementation_refs":["sipi_contracts.models.parse_run_result"],"case_refs":[{"id":"run-result.consumer.good","document":"subject"},{"id":"run-result.consumer.unknown.accept","document":"subject"},{"id":"run-result.consumer.version.reject","document":"subject"}]},"rust":{"state":"covered","implementation_refs":["rust-consumer.validate"],"case_refs":[{"id":"run-result.consumer.good","document":"subject"},{"id":"run-result.consumer.unknown.accept","document":"subject"},{"id":"run-result.consumer.version.reject","document":"subject"}]}}},
    {"id":"run-result.consumer.schema-inventory-unverified","schema_id":"sipi.run-result.v1","obligation":"consumer","layer":"schema","evidence":{"python":{"state":"gap","implementation_refs":["sipi_contracts.models.parse_run_result"],"case_refs":[]},"rust":{"state":"gap","implementation_refs":["rust-consumer.validate"],"case_refs":[]}}},
    {"id":"run-result.consumer.semantic-unverified","schema_id":"sipi.run-result.v1","obligation":"consumer","layer":"semantic","evidence":{"python":{"state":"gap","implementation_refs":["sipi_contracts.models.parse_run_result"],"case_refs":[]},"rust":{"state":"gap","implementation_refs":["rust-consumer.validate"],"case_refs":[]}}},